{
    "id":  "asset-ball",
    "name":  "Ball",
    "category":  "Objects",
    "keywords":  [
                     "ball",
                     "letter b",
                     "alphabet"
                 ],
    "letter":  "B",
    "difficulty":  1,
    "recommendedAge":  [
                           4,
                           5,
                           6
                       ],
    "usage":  {
                  "fullColor":  "Ball.svg",
                  "outline":  "Ball_outline.svg"
              },
    "tags":  [
                 "ball",
                 "kindergarten",
                 "noun"
             ]
}
