{
    "id":  "asset-bell",
    "name":  "Bell",
    "category":  "Objects",
    "keywords":  [
                     "bell",
                     "letter b",
                     "alphabet"
                 ],
    "letter":  "B",
    "difficulty":  1,
    "recommendedAge":  [
                           4,
                           5,
                           6
                       ],
    "usage":  {
                  "fullColor":  "Bell.svg",
                  "outline":  "Bell_outline.svg"
              },
    "tags":  [
                 "bell",
                 "kindergarten",
                 "noun"
             ]
}
