{
    "id":  "asset-bee",
    "name":  "Bee",
    "category":  "Animals",
    "keywords":  [
                     "bee",
                     "letter b",
                     "alphabet"
                 ],
    "letter":  "B",
    "difficulty":  1,
    "recommendedAge":  [
                           4,
                           5,
                           6
                       ],
    "usage":  {
                  "fullColor":  "Bee.svg",
                  "outline":  "Bee_outline.svg"
              },
    "tags":  [
                 "bee",
                 "kindergarten",
                 "noun"
             ]
}
