{
    "id":  "asset-butterfly",
    "name":  "Butterfly",
    "category":  "Animals",
    "keywords":  [
                     "butterfly",
                     "letter b",
                     "alphabet"
                 ],
    "letter":  "B",
    "difficulty":  1,
    "recommendedAge":  [
                           4,
                           5,
                           6
                       ],
    "usage":  {
                  "fullColor":  "Butterfly.svg",
                  "outline":  "Butterfly_outline.svg"
              },
    "tags":  [
                 "butterfly",
                 "kindergarten",
                 "noun"
             ]
}
