{
    "id":  "asset-book",
    "name":  "Book",
    "category":  "Objects",
    "keywords":  [
                     "book",
                     "letter b",
                     "alphabet"
                 ],
    "letter":  "B",
    "difficulty":  1,
    "recommendedAge":  [
                           4,
                           5,
                           6
                       ],
    "usage":  {
                  "fullColor":  "Book.svg",
                  "outline":  "Book_outline.svg"
              },
    "tags":  [
                 "book",
                 "kindergarten",
                 "noun"
             ]
}
