{
    "id":  "asset-bus",
    "name":  "Bus",
    "category":  "Transport",
    "keywords":  [
                     "bus",
                     "letter b",
                     "alphabet"
                 ],
    "letter":  "B",
    "difficulty":  1,
    "recommendedAge":  [
                           4,
                           5,
                           6
                       ],
    "usage":  {
                  "fullColor":  "Bus.svg",
                  "outline":  "Bus_outline.svg"
              },
    "tags":  [
                 "bus",
                 "kindergarten",
                 "noun"
             ]
}
