{
    "id":  "asset-bird",
    "name":  "Bird",
    "category":  "Animals",
    "keywords":  [
                     "bird",
                     "letter b",
                     "alphabet"
                 ],
    "letter":  "B",
    "difficulty":  1,
    "recommendedAge":  [
                           4,
                           5,
                           6
                       ],
    "usage":  {
                  "fullColor":  "Bird.svg",
                  "outline":  "Bird_outline.svg"
              },
    "tags":  [
                 "bird",
                 "kindergarten",
                 "noun"
             ]
}
